{
  "$schema": "https://json-schema.org/draft/2020-12/schema",
  "$id": "https://github.com/heimgewebe/vibe-lab/schemas/run_meta.schema.json",
  "title": "Run Meta",
  "description": "Schema für artifacts/<run-id>/run_meta.json. Execution-Proof-Contract gem. docs/concepts/execution-bound-epistemics.md §5.2. Pflichtartefakt für Experimente mit execution_status ∈ {executed, replicated}.",
  "type": "object",
  "properties": {
    "schema_version": {
      "type": "string",
      "pattern": "^[0-9]+\\.[0-9]+\\.[0-9]+$",
      "description": "Version dieses Schemas (semver)"
    },
    "run_id": {
      "type": "string",
      "minLength": 1,
      "description": "Eindeutiger Run-Identifier; muss mit dem Ordnernamen artifacts/<run-id>/ übereinstimmen"
    },
    "generated_at": {
      "type": "string",
      "format": "date-time",
      "description": "Zeitpunkt des Runs (ISO 8601 / RFC 3339)"
    },
    "executor": {
      "type": "string",
      "minLength": 1,
      "description": "Wer/was den Run ausgeführt hat, z.B. 'local:jhh@host' oder 'ci:github-actions'"
    },
    "command": {
      "type": "string",
      "minLength": 1,
      "description": "Genau ausgeführter Befehl, damit der Run reproduzierbar dokumentiert ist"
    },
    "exit_code": {
      "type": "integer",
      "description": "Exit-Code des ausgeführten Prozesses"
    },
    "test_output_file": {
      "type": "string",
      "minLength": 1,
      "description": "Relativer Pfad zur erfassten Ausgabe (Log/Transkript/Report), relativ zum Experiment-Root"
    },
    "provenance_level": {
      "type": "string",
      "enum": ["self_reported", "machine_verified"],
      "description": "Herkunftsniveau: self_reported (Mensch hat Run dokumentiert), machine_verified (CI/Pipeline-Run mit verifizierbaren Spuren)"
    }
  },
  "required": [
    "schema_version",
    "run_id",
    "generated_at",
    "executor",
    "command",
    "exit_code",
    "test_output_file",
    "provenance_level"
  ],
  "additionalProperties": true
}
