{
  "schema_version": "0.1.0",
  "run_id": "run-reconstructed",
  "generated_at": "2026-04-14T00:00:00Z",
  "executor": "local:unknown-agent",
  "command": "python3 test_spec_first_roman.py",
  "exit_code": 0,
  "test_output_file": "artifacts/spec_first_run.txt",
  "provenance_level": "self_reported"
}
