{
  "schema_version": "1.0.0",
  "run_id": "run-025-bureau-proposal",
  "generated_at": "2026-07-03T12:20:00Z",
  "executor": "operator:chatgpt-grabowski",
  "command": "record Cabinet proposal",
  "exit_code": 0,
  "test_output_file": "artifacts/run-025-bureau-proposal/run-card.yml",
  "provenance_level": "self_reported"
}
