{
  "schema_version": "0.1.0",
  "run_id": "run-003-validator-test-hardening",
  "generated_at": "2026-05-27T17:07:33Z",
  "executor": "copilot-coding-agent:gpt-5.4",
  "command": "bash -o pipefail -c 'make validate | tee experiments/2026-05-25_outcome-evidence-replication-series/artifacts/run-003-validator-test-hardening/make-validate.txt'",
  "exit_code": 0,
  "test_output_file": "artifacts/run-003-validator-test-hardening/make-validate.txt",
  "provenance_level": "self_reported"
}