{
  "schema_version": "0.1.0",
  "run_id": "run-2026-04-24-phase1-001",
  "generated_at": "2026-04-24T10:16:00Z",
  "executor": "local:alex@heim-pc",
  "command": "make validate (final repo-guard after execution sequence)",
  "exit_code": 0,
  "test_output_file": "artifacts/run-2026-04-24-phase1-001/execution.txt",
  "provenance_level": "self_reported"
}
