{
  "schema_version": "0.1.0",
  "run_id": "run-006-treatment",
  "generated_at": "2026-04-16T14:28:00Z",
  "executor": "local:copilot-agent",
  "command": "Treatment arm execution of T2,T4,T6,T8 from tasks.iteration4.jsonl — logic-level edits with explicit per-task protocol",
  "exit_code": 0,
  "test_output_file": "artifacts/run-006-treatment/execution.txt",
  "provenance_level": "self_reported"
}
