{
  "schema_version": "0.1.0",
  "run_id": "run-001-control-legacy",
  "generated_at": "2026-04-14T00:00:00Z",
  "executor": "local:unknown-agent",
  "command": "python3 -m unittest test_processor.py",
  "exit_code": 0,
  "test_output_file": "artifacts/run-001-control-legacy/test_output.txt",
  "provenance_level": "self_reported"
}
